title,author,abstract
"Effects of Dietary Interventions on Treatment for Patients with Anxiety and Depression, A Systematic Review","Erickson, Rylyn; Schafer, Gerald","Objective: To review literature regarding the effects of implementing dietary and nutritional intervention in treatments for depression or anxiety patients. Methods: PubMed and CINAHL literature sources were reviewed regarding the effectiveness of dietary or nutritional interventions on anxiety or depression. Results: Most of the sources found a relationship between increased depression or anxiety and poor diets and supported the finding that dietary implementations such as low calorie diets, higher fruit and vegetable intakes, and visits with dietary specialists to improve nutrition intakes, have positive effects on patients with anxiety and depression. Conclusion: Dietary and nutritional interventions have shown positive outcomes in treatments for anxiety or depression. Interventions researched in the review support the findings that dietary interventions benefit patients with anxiety and depression. Further research on specifically what dietary interventions work best for anxiety and depression is necessary. "
The Impact of Psychosocial Intervention for Depression following Lower Extremity Injuries: A Systematic Review,"Greene, Sarah","Objective. To review the current literature regarding the impact of psychosocial interventions for mental health issues in collegiate athletes. Methods. Literature was gathered through PubMed and Google Scholar to identify articles about the impact of psychosocial interventions on the overall well-being of collegiate athletes. The interventions included were mindfulness-based interventions and cognitive behavioral therapy. Results. All articles in this review support using mindfulness-based interventions and cognitive behavioral therapy as treatments for mental health issues in athletes. In addition to improved mental health among the athletic population, other aspects of the athlete were improved, including pain tolerance, mental toughness, and ability to cope with adversities. Conclusion. Psychosocial interventions like mindfulness-based interventions and cognitive behavioral therapies provide many benefits that support the overall well-being of collegiate athletes. "
Comparing Surgical and Pharmaceutical Techniques for Treating Uncomplicated Appendicitis,"Normandeau, James; Schafer, Gerald","Objective: To review current literature and determine whether nonoperative management of acute appendicitis provides accelerated recovery when compared to surgical appendectomy after one year in pediatric patients. Methods: Literature was collected from PubMed. Articles were assessed to determine the success rate, quality of life, hospital recovery time, or return to normal activity for the patient and/or caregiver, following nonoperative management or surgical appendectomy in pediatric patients. Results: The articles for the most part supported the conclusion that nonoperative management of appendicitis is a safe alternative to appendectomy. Relapse rates typically were around 70% for nonoperative patients. For patients who did not relapse following initial nonoperative treatment, hospital and recovery times were often shorter than patients in the surgical groups. However, when the patients who failed nonoperative management were considered, the data did not show significantly faster recovery time than the surgical groups. Conclusion: Research suggests that nonoperative management of acute appendicitis does not lead to accelerated patient recovery when compared to surgical management of appendicitis in pediatric patients MeSH Keywords: Appendectomy; nonoperative; conservative; pediatric; appendicitis "
"In Middle Aged Women with HPV and Risk of Cervical Cancer, How Does HPV DNA Testing Compare to Cervical Cytology in Detecting Cervical Cancer.","Arroyo, Aura; Parsley, Kelly","Objective: To review current literature regarding the performance of HPV and cytology tests for cervical cancer. Methods: Literature was gathered through PubMed, CINAHL, and Google Scholar and assessed for the effectiveness of HPV and cytology tests detecting cervical cancer. Results: Most of the literature displayed support for HPV testing since it has favorable results for women being screened for cervical cancer. Cervical cytology was stronger in detecting specificity which has led to using both tests together. When different methods were directly compared, the studies favored HPV testing as the preferred method for improving the detection of cervical cancer in women with HPV, but the optimal solution was it being adjunct with cytology. Conclusion: The interventions mentioned in this review should be researched further to find that gold standard diagnosis in middle aged women. HPV screening and cytology screening together have shown promising results for women who are doing routine screenings to detect cervical cancer. "
Under Pressure: A Systematic Review of Weighted Blankets for Treatment of Anxiety and Insomnia,"Holmes, Macie; Schafer, Gerald","Objective: The purpose of this study was to investigate the efficacy of weighted blankets in providing relief to anxiety and insomnia caused by a variety of health disparities and diagnoses. Methods: Using Pubmed and CINAHL, articles were selected reporting on research on the use of weighted blankets for different diagnoses. Health conditions included autism spectrum disorder, attention hyper deficit disorder, chronic pain, eating disorders, old age, and chemotherapy. Results: Most articles demonstrated a decrease in anxiety and reduced sleeping medications with the use of weighted blankets. The only side effects noted by patients was minor discomfort. Depending upon the prescription process for obtaining weighted blankets, they were a cost effective intervention that was safe for adults and children under supervision. Discussion: Weighted blankets are an effective intervention in decreasing anxiety and insomnia associated with multiple health conditions, at a relatively low cost. "
Carotenoids and Their Effects on Macular Degeneration: a Systematic Review,"Bomengen, McKenna; Schafer, Gerald","Objective: To review current literature concerning the effectiveness of lutein and carotenoid supplementation in preventing progression of Age-Related Macular Degeneration. Methods: Search engines PubMed and CIHNAL were used and further assessed for associations between the effectiveness of Lutein and the prevention of Macular Degeneration. The interventions included were AREDS, AREDS2, MaQuprev, lutein, zeaxanthin, vitamin C, vitamin E, beta carotene, zinc oxide, omega-3 long-chain polyunsaturated fatty acids, docosahexaenoic acid, eicosapentaenoic acid, and cupric oxide. Results: Most of the literature pointed to these treatments the slowing of ARMD progression. Two studies did not report slowing of ARMD when treated with combinations of carotenoids, vitamins, and other anti-inflammatory substances. Conclusion: Results were inconclusive. Not all studies reported significant figures supporting supplements in treatment of the slow of ARMD progression. Carotenoid interventions have shown promising results for the prevention of ARMD. The interventions mentioned in this review should be researched further to provide additional treatment options. Keywords: Age Related Macular Degeneration, Prevention, Lutein, Carotenoids "
Chronic Wound Treatment Using Mesenchymal Stem Cells: A Systematic Review,"Taugher, Dominique; Schafer, Gerald","Objective: To review current literature about the effectiveness of mesenchymal stem cell treatment on chronic wounds. Methods: Literature was gathered through PubMed, CINHAL, and Google Scholar and assessed for the effectiveness of mesenchymal stem cell (MSC) treatment on chronic wounds. Results: The majority of the literature supported the stance that MSC interventions have a favorable effect on patients with chronic skin wounds. Conclusions: MSC treatment shows promising results for patients with chronic skin wounds. The treatment mentioned in this review should be researched further to discover the best dosage and further studies should examine the safety of MSCs. When different dosages were directly compared, studies didn’t identify a preferred dosage for best improving skin dermis in patients with chronic skin wounds. Keywords: Mesenchymal stem cells; chronic wounds; psoriasis; atopic dermatitis; diabetes mellitus; acute skin wounds; recessive dystrophic epidermolysis bullosa. "
"Dietary Soy Consumption and its Impact on Male Fertility, a Systematic Review","Babin, Bailey; Schafer, Gerald","Objective: To review current literature regarding impacts of dietary soy on male fertility. Methods: Literature was gathered through PubMed and CINAHL and assessed for impacts on male fertility. Dietary soy products included foods that contained isoflavone phytoestrogens. Results: Of the studies in this review, two involving mice, half found that dietary soy negatively affects male fertility, while the other half found that dietary soy has no effects on male fertility. Conclusion: Further studies should be conducted with a longer duration before coming to a concrete conclusion of whether or not the presence of dietary soy, including isoflavones, adversely affects male fertility. Keywords: Fertility; isoflavones; soy products; estrogens; reproduction. "
The Impacts of Aerobic and Anaerobic Exercise on Neuropsychiatric Symptoms (NPS) for Middle Aged and Older Adults with Alzheimer’s; A Systematic Review,"Jones, Sadie; Schafer, Gerald","Objective. To review the impact of aerobic and anaerobic exercise on neuropsychiatric symptoms (NPS) in middle aged and older adults with Alzheimer’s Disease (AD). Methods. Studies found through PubMed and CINAHL databases were reviewed for associations between aerobic exercise and anaerobic exercise affecting NPS with those with AD. There were 64 articles identified from both databases which were then narrowed down to eight qualitative articles. Results. Aerobic exercise was strongly correlated with an improvement of NPS which includes depression, stress, and aggression in studies designed with specific durations of physical exercise. In some studies, anaerobic exercise found memory training to be effective for reducing NPS. Conclusions. While anaerobic exercise influenced changes in behavioral symptoms, current research suggests that aerobic exercise has a greater impact on NPS, leading to a reduction in stress and depression in individuals with AD. "
Prevalence of Ventricular Tachycardia Reoccurrence Following Catheter Ablation in Patients With Arrhythmogenic Right Ventricular Cardiomyopathy: A Systematic Review,"Moseley, Marie; Schafer, Gerald","Objective: To evaluate studies regarding the prevalence of ventricular tachycardia (VT) reoccurrence following catheter ablation in patients with arrhythmogenic right ventricular cardiomyopathy (ARVC) who present with persistent ventricular tachycardia. Methods: Literature was identified using CINAHL and PubMed and evaluated for effectiveness of catheter ablation in preventing VT reoccurrence following ablation in ARVC patients with persistent ventricular tachycardia. Results: Most of the literature found catheter ablation to be an effective treatment for ARVC patients with persistent ventricular tachycardia, however, ventricular tachycardia reoccurrence was common in the majority of the studies. Across the 9 nine studies analyzed, after one catheter ablation procedure the VT reoccurrence rate was near 50%. Conclusion: Catheter ablation shows promising results for ARVC patients with persistent VT. However, further research should be done to fully establish the efficacy of this treatment. The use of improved mapping techniques could potentially lower VT reoccurrence rates following ablation. "
Hybrid Closed Loop Insulin Delivery System Treatment for Adults and Adolescents with Type One Diabetes Mellitus: A Systematic Review,"Tuggle, Baxter; Schafer, Gerald",Objective: To review current literature that assesses the effectiveness of hybrid closed loop insulin pumps at improving time in range (TIR) and HbA1C for adults and adolescents with Type One Diabetes Meletus (T1D). Methods: Literature gathered through PubMed and CINAHL databases was reviewed for associations between HCL and improved TIR along with HbA1C in adults and adolescents with T1D. Results: HCL showed a strong relationship between improved TIR and HbA1C in adults and adolescents with T1D. Discussion: All studies showed a strong association between HCL and improved TIR along with HbA1C. These findings should influence the way health care providers treat T1D. 
Diagnosis Methods in Horses with Potomac Horse Fever,"Abernathy, Natalie; Schafer, Gerald","Objective. To review current literature on the most effective method of diagnosing Potomac horse fever. Methods. Literature was gathered from PubMed, Web of Science, and Google Scholar, and assessed for effectiveness of diagnostic methods of Potomac horse fever. Results. The majority of articles indicated that using PCR as a means of detecting Potomac horse fever was most effective. Use of enzyme-linked immunosorbent assay was also indicated in some articles as being an effective method. Conclusion. The use of PCR as a means of diagnosing Potomac horse fever was found to have the least amount of false positive and false negative results when compared to IFA and ELISA diagnostic tests. PCR is the most commonly used diagnostic method for detecting Potomac horse fever. "
"The Effects of Intermittent Fasting Diet at Different Stages of Circadian Rhythm on Mus musculus on Metabolic Rate, Glucose and Ketone Levels, and Overall Body Fat Loss","Lohr, Kelsyn; Sheafor, Brandon","Intermittent fasting (IF) diets are popular weight loss regimens that are thought to promote heart health, fight inflammation, and reduce risk of cancer. For humans, fasting periods typically take place during the night with feeding periods during the day. However, it is unknown if this is the best fasting method in relation to a mammal’s circadian rhythm. Using laboratory mice (Mus musculus), we will study the efficacy of the IF diets at different points within a daily circadian rhythm. Mice will be placed in three groups: mice feeding ad libitum, mice fasting overnight, and mice fasting during the day. Metabolic rate, respiratory quotient, urine glucose and ketone levels, and overall weight change of the three groups will be quantified over a seven week period. Glucose and ketone levels will be tested using 96 well colorimetric assay kits. A flow-through respirometer will be used to test metabolic rate and respiratory quotient. If the time of day at which fasting occurs results in changes in lipid metabolism then we should observe significant differences in metabolic rate, respiratory quotient, urine glucose and ketone levels, and body weight between the daytime and nighttime fasted mice. "
Latina Women: Invisible Pillars of Power,"Hoelscher, Lily; Hallows, Ryan","This presentation addresses the nature of identity in specific regards to women in Latino communities, examining effects of both intercultural stereotypes and intracultural conflict on women within their groups of origin and how they are perceived by the broader world. Personal relationships with other women in their lives and with Latino men are a defining factor of this exploration and will be discussed through examples from fictional and biographical literature by Latino/a authors. As societal influences on cultural identities are further illustrated, the power – or lack thereof – of the Latina woman within family and community structures will be brought to the fore. Through recent works by Latina artists and activists revealing multiple dimensions of their own social and psychological experiences, it is hopeful that in the near future the Latina woman’s unique position will finally be seen and heard in a world that so often seeks to crush her. "
Fixing Parking Problems & Honoring Our Student Veterans,"Rector, Ryan; Christian, Patricia","At Carroll, parking for students is a challenge. Rarely are there any open “Permitted Student” parking spaces in semi-convenient locations around campus during campus peak hours. Meanwhile, data showed that there were, on average, 39 unused “Staff/Faculty” parking spaces around campus during peak hours (10am & 2pm). The proposal was a research supported proposal that was intended to fix a problem in a meaningful way with 10 of the 39 available, unused, non-assigned “Staff/Faculty” parking spaces around campus. We proposed that 10 of those 39 spaces be assigned and made available to all currently enrolled “Student Veterans.” For good measure, it is also suggested that Carroll College consider investing in some Student Veteran/Veteran Spaces in the HAC/PE Center parking lot. The proposal has received unanimous approval from every major governing body on the Carroll campus. The research conducted was not your typical college research project. It was not for any class. The study ended up being a collaborative effort between the Student Veterans Organization, Veteran Services, Campus Safety and Security, Securitas, and Facilities. Securitas conducted the 5 week data collection process. Every non-assigned Staff/Faculty parking space was counted, and recorded, per location. All assigned/designated parking spaces were omitted from the count and data collection process. Peak hours were identified prior to the beginning of the semester. It was assumed that the peak hours would result in the most impacted parking times for the campus. Thus, the parking spaces were counted twice each working day M-F, at the hours of 10am and 2pm. For each week, per lot, an average was measured per time 10 & 2. Then each lot was averaged for each time per each lot. Then every lot was averaged for each time. Then each time was averaged together to get the 39 avg. unused parking spaces at any given time of day. This average was then reduced by 10 spaces for new staff/faculty employees. Currently we have 24 student veterans enrolled at Carroll. The amount of parking spaces that were proposed was 10-12 spaces that would be assigned to only Student Veterans. These spaces were to be spread out over the staff and faculty parking lots that had the most availability around campus. Thus leaving a safe buffer of 29 unused staff and faculty parking spaces around the campus. The 10 new signed spaces for student veterans is ultimately beneficial for the entire Carroll Community. Student Veterans get more preferential parking around campus, parking around the campus will be utilized more efficiently, and traditional students will theoretically gain 10 parking spaces. Having semi-permanent “Student Veteran Parking Spaces” spread around campus is a great recruitment tool for Carroll to employ when looking to get more student veterans enrolled at Carroll. "
Sir Gawain and the Green Knight: Part I,"Wallis, Caleb; Graham, Loren","Sir Gawain and the Green Knight is a 14th century chivalric romance poem written in Middle English with a combination of alliterative and rhyming meter. Despite the poem’s popularity in recent media, this is all of what we know about The Green Knight’s history. When it comes to other popular mythological pieces such as The Odyssey, a title of distinct authorship gives these poems a defined time and style, which in turn leads to a figure of authority over the poem itself. Even many poems without an author, such as Beowulf, still manage to retain such a figure through their continued use in academic and popular spaces, as seen in the prominence of translators such as Chickering and Heaney. The Green Knight, however, not only has an absent author, but also any major figure of authority. No one owns The Green Knight in the way Homer owns the Odyssey, nor is anyone The Green Knight’s academic standard in the way Chickering’s translation is for Beowulf. This creates an immediate draw for any translator seeking to work with medieval source material, as such a lack of authority means that, through the skill and style of a talented translator, The Green Knight can be made one’s own in a way that The Odyssey cannot. In this light, I will be presenting my own translation of Sir Gawain and the Green Knight. This translation is in modern prose and seeks to combine both medieval and modern language with the poem’s existing alliterative style. "
“Se reconstruire” : building a feminist economy in Rwanda post-genocide,"Badaruddin, Helen; Crohas, Julie","The 1994 Rwandan genocide devastated the country’s political, economic, and social core. With around 800,000 people dead, around 60 to 70% of the surviving population were women. Just three decades after their independence from the Belgian colonial empire, the surviving women were left to reconstruct Rwanda again, and now, women represent more than 60% of their parliamentarians. However, theorists such as Briggs note that their political representation may not translate to social and economic equality. This research explores the economic implications of Rwanda’s women-led government through an examination of macroeconomic trends since the genocide. "
Social Barriers and their Affects on the Availability and Accessibility of Menstrual Products,"VanSickle, Emma; Johnson, Jeremy","Objectives: To review current literature to determine the effects of social barriers on menstrual products and menstrual health on women and individuals who menstruate. Methods: Literature was gathered from PubMed and CINHAL databases and assessed for association between menstruators, menstrual products, and accessibility. Results: The overall findings based on the information found were consistent with the conclusion that social barriers have large impacts on the accessibility of menstrual products to individuals who menstruate. All studies and literature supported the results and further explained the issues surrounding menstrual health across multiple countries. Conclusion: Menstrual health and hygiene should be seen as “health-related necessities” and yet those who are homeless, have a disability, or are from countries where menstrual health is not seen as a necessity, have difficulties accessing reproductive health care and menstrual products. By changing the stigma and social normalities surrounding reproductive health and menstruation, more individuals can gain higher education, feel more comfortable and confident during their periods, and gain higher access to menstrual products and necessities. "
An Evolutionary Exploration of Drag,"O'Reilly, Kyra; Fregulia, Jeanette","Drag, a performative art in which individuals dress in exaggerated and artistic displays of gender, has a long history and has been seen worldwide for centuries. For example, in the fourteenth century, women would dress as men to attend tournaments, and while at the time, that was not defined as drag, it can today be seen as such. Similarly, in Shakespearean theatre, where women were not allowed to act, men would dress up and play the female characters in the show. In the 1800s, the term drag emerged in the media to describe men dressing as women. In the United States in 1858, William Swan, a formerly enslaved person, became a self-named queen of drag. Despite its long history, there has been a shift from seeing drag as a celebrated art form to a perverse manipulation. In this presentation, I explore these questions: What does history have to say about drag? Why are drag performers being targeted so egregiously? What are current media platforms saying, and is this attack on drag only the start of a bigger attack on the queer community? "
"Meaning, morality, and the need for a Rearticulation of the self","Gold, Greyson; Glowienka, Edward","My research examines contemporary philosophy surrounding the moral values and meaning which make up the self. I seek to articulate what Charles Taylor labels the best account of the moral self––the system which provides the most fitting and consistent framework by which to explain the complexity of the human. I look at the works of atheist thinkers Friedrich Nietzsche, one of the founders of Postmodernism, and Jean-Paul Sartre, one of the primary existentialist thinkers, to examine some of the contemporary notions of the moral self. I argue that these thinkers fail to provide a best account of the moral self. Alternately, bringing in the thought of Iris Murdoch, Charles Taylor, and Susan Wolf, I argue that the moral self is not limitable to a Nietzschean becoming or an existential willing, but must be explained in relation to a higher telos, an object of love, an aim for moral growth, by which one can judge the goodness of one’s actions and the meaningfulness of one’s life. I also discuss the role of narrative art in articulating aspects of the moral self, arguing that effective narrative art supports my teleological framework. "
