title,author,abstract
Investigating the Potential for Antidepressant-Induced Worsening of Depression in the C. elegans Model System,"McEuen, Katherine; Radosevich, Timothy; Sheafor, Brandon","In 2018, over 70.9 million antidepressant items were prescribed, with about 9.5% of adult Americans struggling with some form of depression each year. An effective and widely used class of drugs to combat depression symptoms are selective serotonin reuptake inhibitors (SSRIs). Unfortunately, the most prescribed SSRIs, fluoxetine (under the brand name Prozac), can induce considerable side effects. According to the national library of medicine, 30.4% of patients who take the common SSRI fluoxetine will develop acute worsening of depression (Ungvari et al., 2019). These symptoms may manifest as fatigue, reduced sexual drive, and/or decreased metabolic rate. While research has been performed on worsening depression due to SSRIs in humans, it is unclear whether the cause is psychological or pharmacological due to biases with self-reporting. We will use hermaphroditic Caenorhabditis elegans as a model organism because they have serotonin receptors similar to those found in humans. We will expose C. elegans to fluoxetine and perform several behavioral and physiological tests to assess symptoms of depression. These exams will evaluate heart rate (a general indicator of baseline health), reproductive drive, and responses to stress and external stimuli. Each test was selected from the DSM-5 criteria for Major Depressive Disorder in humans. If C. elegans develop the aforementioned symptoms, we can conclude fluoxetine intake manifests in physiological reactions. If few to none of the symptoms are present, it would indicate that the depression with fluoxetine is more psychologically than physiologically based. "
Characterizing Microbial Communities among the Berkeley Pit Water Filtration System,"Held, Benjamin; Beck, Ashley","Once called the “richest hill on earth”, the Berkeley Pit copper mine in Butte, Montana is now a deadly Federal Superfund site. A treatment plant was opened in 2019 to purify and polish water from the Pit for reintroduction to local waterways. Once water is treated for toxic and heavy metals, the purified water is introduced into Silver Bow Creek, just below the Pit. Purification efforts have been successful in removing toxic materials, but no research has been done on microbial communities. To investigate microbial diversity, water samples were taken from nine sites in and around Butte including: the Berkeley Pit; the water treatment plant; the purified water introduction site; stream locations up to 10 miles west of Butte. The microbiome of each site was characterized through Nanopore 16S gene sequencing, and community composition was compared across sites. Notable results include a high concentration of Acidobacteria found only in the Berkeley Pit, a Bacteroidetes presence in all sites but the Pit, and an increasing concentration of Proteobacteria with distance from the purified water introduction site. This research presents an initial survey of microbial diversity as an indicator of ecosystem health in our invaluable water sources. "
The Effects of Fun on Executive Functioning,"Bradt, Katie; Kastner, Kaden; Honzel, Nikki","Few studies in neuroscience have studied the effect of “fun” on the brain. Therefore, the current study investigated the connection between fun and executive functioning using EEG recordings. Forty undergraduate students participated in the study. Fifteen participants played jenga with a friend of their choice, rated their level of fun on a scale of one to six, and then underwent a computerized task to measure levels of executive functioning using EEG recordings. Previous studies found that playing games with a friend significantly increases levels of self-perceived fun, compared to completing tasks alone (Reis et al., 2017). To compare the effect of fun, the control group consisted of twenty-five participants. In the control group, participants were asked to complete questionnaires prior to completing the EEG task. The total amount of time completing the study was similar between groups. The EEG data will be segmented to specific neurological components that reflect aspects of cognitive functioning, such as attention and memory. The current data analysis focused on two specific peaks, N2 and P3. The two peaks correspond to conflict detection and response inhibition, respectively (Shi, 2022). Physiologically, anger and excitement can be similar (Schacter, 1964). Previous studies have found reduced N2 and increased P3 responses in individuals that score higher on an anger trait (Liu et al., 2015). Therefore, it is hypothesized that participants in the fun group will have larger P3 and smaller N2 amplitudes compared to the non-fun group (Dierolf et al., 2017; Liu et al., 2015; Xia et al., 2020). "
Seasonal Changes to Developing Insecticide Resistance in Mosquito Vector Species in Montana.,"Jones, Amber; Hokit, Grant","Insecticide resistance (IR) in mosquitos is becoming increasingly important to monitor in order to protect the health of humans and other animals. This is necessary for public health because mosquito-borne diseases continue to persist all over the world, despite the efforts to mitigate possible vectors. The development of IR may be why there has been failure with control attempts. The purpose of this research was to determine the effect of several common insecticides including chlorpyrifos, naled, and permethrin on the mechanism of resistance among several species of mosquitoes across Montana. It was hypothesized that mortality rates in mosquitoes exposed to each insecticide would decrease over the eight weeks of experimentation. To test this hypothesis, surveillance sites that were dominated by one species were selected for IR testing. Four bottles were coated with prepared CDC recommended concentrations of each insecticide, while the control bottles were coated in acetone. After the bottles were air-dried for at least 60 minutes, the mosquitoes were introduced using a standard mouth aspirator. The number of mosquitoes were counted upon introduction, and then at specific time increments up to 120 minutes. Each mosquito exposed to insecticides were speciated, and the mortality was calculated. This protocol was repeated over the 8 weeks of the study. The results suggest that there is evidence of developing resistance of the insecticides tested, but further study is needed to determine the pathway of resistance. "
"The Potential for DEM, DEF, or PBO as an Enzymatic Pathway for Resistance to Chlorpyrifos in Aedes vexans","Anselmo, Belle; Hokit, Grant","Mosquito resistance to insecticides is an emerging issue, as increased resistance means less methods of population control. Previous research has shown developing and established resistance in Aedes vexans to the insecticide chlorpyrifos. Mosquitoes can carry many vector-borne diseases such as Zika virus, West Nile virus, and malaria. A key aspect in preventing the transmission of these diseases is using effective insecticides. As insecticide resistance in mosquitoes continues to emerge, understanding the enzymatic pathways behind this resistance is critical. Potential enzymatic pathways could involve the inhibitors diethyl maleate (DEM), S,S,S-tributyl phosphorotrithioate (DEF), or piperonyl butoxide (PBO). Mosquitoes were trapped from various collection sites, and CDC bottle bioassay guidelines were followed for exposure of mosquitoes to one of three inhibitors. After this exposure, mosquitos were separated into a control bottle or a bottle coated with chlorpyrifos. The number of dead individuals were counted at regular intervals, and percent mortality was calculated and compared to the established diagnostic time of death for Aedes exposed to chlorpyrifos. It is anticipated that if the activity of a specified enzyme plays a role in resistance, exposure to the respective inhibitor will prevent this enzymatic pathway and mosquitoes will have an increased mortality rate. Simulation analysis will be used to analyze both the impact of exposure to chlorpyrifos and exposure to DEM, DEF, or PBO. If this mathematical analysis reveals a significant impact of inhibitor exposure on mortality rate, further assays could be performed to examine the extent of this pathway across species. "
Spatiotemporal Modeling of Microbial Community Interactions,"Short, Samantha; Beck, Ashley","Bacterial communities are essential to plant growth and development; soil microbes can colonize roots and enter into symbiosis with plants, exchanging nutrients and protecting against pathogens. Relatively little is understood about the mechanisms that shape bacterial communities and govern plant-microbe interactions. Environmental conditions, such as plant hosts, soil nutrient conditions, pH, and temperature, influence species' metabolic responses and resulting interspecies interactions as a function of both space and time. Cooperation or competition between bacterial species is likely affected by both their metabolic capabilities and the heterogeneous micro-niches within plant roots. These interactions are very difficult to dissect experimentally, and modeling provides a great tool to develop hypotheses about interactions. This study investigates the utility of the Computation of Microbial Ecosystems in Time and Space (COMETs) software for spatiotemporal metabolic modeling to predict bacterial metabolic and growth responses in simulated environments for seven key bacteria associated with maize roots. "
Characterizing Nitrogen and Aquatic Microbial Communities Across Montana,"Keil-Hoye, Serena; Bold, Katherine; Beck, Ashley","As water is becoming an extremely scarce and precious resource, it is integral to understand the relationship between Montana’s water resources and the effects of nitrogen on water quality. This experiment aims to characterize the relationship between microbial communities and nitrogen levels in natural and man-made water bodies across Central and NorthWest Montana. We expect the higher levels of nitrogen to correlate to more harmful bacteria in the water and for there to be more nitrogen in man-made bodies of water than in natural bodies of water. Water samples were collected during March and October 2022 from eight locations for chemical analysis, and sediment samples were also collected in October for microbial analysis. Genomic DNA was extracted from the sediment samples, followed by PCR amplification of the 16S gene and Nanopore sequencing to determine the relative composition of bacterial groups in each sampling location. Nitrate and nitrite levels were determined by Energy Labs (Helena, Montana) and correlated with bacterial community composition. Here we present findings on patterns of microbial communities across Montana water sources in relation to nitrogen levels to address the increased concerns regarding the quality of our water sources. "
Investigating the Efficacy of Disinfectants to Minimize Common Bacterial Contamination in Laboratories,"Wald, Elliot; Lepage, June; Beck, Ashley","Maintaining laboratory safety requires an understanding of how to properly disinfect biological contaminations. Carroll College labs often work with common bacterial strains that need proper handling and effective disinfection in the event of contamination. Disinfectants vary in their ability to maintain a clean lab environment. This project compares the effectiveness of Vesphene III-se and bleach to disinfect some of the most common bacteria used in Carroll labs: Bacillus subtillis, Staphylococcus epidermidis, and Pseudomonas aeruginosa. The standard concentrations of Vesphene and bleach were tested with contact times of 5, 10, and 20 minutes. Cultures were incubated with the disinfectant, diluted, and plated. The viable bacteria were counted after treatment to determine the effectiveness of the disinfectant. We will present findings on the correlation between contact times and bacterial viability for different disinfectant concentrations. Our results will help update Carroll’s biological contamination protocol, to optimize safety and efficiency in Carroll labs. "
Time Course of Metabolic Shifts in Cartilage Explants Exposed to Short-Term Simulated Microgravity,"Houske, Eden; Chapman, Marrin; Bourekis, Kiki; Hahn, Alyssa","Evidence suggests that abnormal mechanical loading leads to an imbalance in chondrocyte metabolism that results in cartilage degeneration – a hallmark of osteoarthritis (OA). Microgravity exposure in space reduces mechanical loads, potentially leading to increased catabolic activity of chondrocytes and the development of OA. This study aimed to assess how chondrocyte metabolism is altered in response to simulated microgravity (SM) exposure to gain insight into the mechanisms responsible for cartilage degeneration in reduced-loading environments. Healthy post-mortem human cartilage explants were exposed to SM for 1 or 4 days using a Rotating Wall Vessel (RWV) bioreactor with the remaining control explants exposed to normal gravitational forces. A subset of the control and SM explants were analyzed for cell viability by staining and measuring relative fluorescence units. Metabolites were extracted from explants and surrounding media and data were generated by liquid chromatography-mass spectrometry. Pathways upregulated in response to SM include pyrimidine, amino acid, and sugar metabolism which may be suggestive of extracellular matrix remodeling. Changes in metabolites secreted from explants into the surrounding media mapped to lysine and vitamin E metabolism. These have been previously detected in human synovial fluid from osteoarthritic donors, suggesting that even short-term SM exposure may induce metabolic shifts similar to that of early OA. Notably, this is the first study to map global metabolic changes in cartilage in response to short-term SM exposure to gain insight into the risk of developing OA post-spaceflight. "
Generation of Global Metabolomic Profiles of Normal and ADPKD Renal Epithelial Cells Exposed to Fluid Flow-Induced Shear Stress,"Goulet, Elaina; Ward, Michael; Hahn, Alyssa","Autosomal Dominant Polycystic Kidney Disease (ADPKD) is a hereditary disease that is the 4th leading cause of renal replacement and failure worldwide. The disease has been linked to mutations of polycystins 1 and 2 in primary cilia in renal epithelial cells under fluid flow shear stress. Cellular pathways become altered due to impaired mechanotransduction, ultimately leading to the formation of renal cysts. The goal of this study was to characterize the metabolic response of ADPKD cell lines under fluid flow-induced shear stress in comparison to healthy renal epithelial cells under static controls. ADPKD cell lines (WT 9-7 and WT 9-12) and healthy renal epithelial cell lines (HK-2) were cultured and exposed to either fluid flow or static conditions and metabolites were extracted for LC-MS analysis. ADPKD cell lines exhibited metabolic changes in response to fluid flow-induced shear stress in comparison to healthy renal epithelial cells, suggestive of dysfunctional mechanotransduction. There were also differences between the two ADPKD cell lines, suggestive of cells being affected differently. This study provides a greater understanding of metabolism in ADPKD pathogenesis for the identification of potential drug targets to slow or ameliorate disease. "
Staphylococcus aureus Indicator,"Crichton, Juliette; Breit, Julianna; Chennai, Oviya; Lieberg, Jaedon; Kuga, Kylie; Rowley, John","The long-range objective of this research is to develop a chemical method to detect Staphylococcus aureus (S. aureus). Herein we assess the viability of using the controlled emission and quenching of fluorescent dyes as that chemical detection method. One of the major extracellular proteases produced by S. aureus is the V8 protease which cleaves peptide bonds connected to glutamic acid. When the V8 protease cleaves the dye-quenching glutamic acid from the dye-tagged amino acid chain, the remaining poorly-quenching amino acid will allow the dye to fluoresce, indicating the presence of S. aureus. Preliminary fluorescence quenching of 2’7 dichlorofluorescein (2’7 DCF) was performed using Stern-Volmer analysis to assess the viability of a fluorophore-quencher/peptide compound. Irrespective of pH, the fluorescence of 2’7 DCF was strongly quenched by glutamic acid with a quenching constant of 37.04. The fluorescence of 2’7 DCF was weakly quenched by amino acids alanine, proline, and glycine with quenching constants of 1.24, 1.28, and 1.27 respectively. Using this quenching behavior, we propose the synthesis of a fluorophore-quencher/peptide compound in which the 2’7 DCF is covalently bound to a weakly quenching peptide chain containing glutamic acid. "
Activation Energy of Enzyme and Non-Enzyme Catalyzed Reactions,"Ayers, Kaitlynn; Abernathy, Natalie; Gannon, Sydney; Moseley, Marie; Rowley, John","The goal of this research was to compare the activation energy and rate constants of an enzyme catalyzed and a non-enzyme catalyzed hydrolysis reaction at different temperatures. NaOH was used as the non-enzyme catalyst and esterase was used as the enzyme catalyst. Using UV-Vis Spectroscopy, the catalyzed transformation from p-nitrophenylacetate to p-nitrophenol was observed. It was found through curve-fit analysis that the rate constants for both were temperature dependent. Arrhenius analysis utilizing these constants determined activation energies of 57.53 kJ/mol for the esterase and 58.02 kJ/mol for NaOH. These results suggest enzyme catalyzed reactions have a lower activation energy and therefore a faster rate of reaction than non-enzyme catalyzed reactions. "
Photoinitiated Site Specific Drug Release,"Schaan, Mandy; Short, Sam; Hurst, Alyssa; Wimmer, Peyton; Rowley, John",No abstract
Metal-oxide Photovoltaic Cells Synthesized using Materials Abundant in the Martian Regolith,"Radosevich, Timothy; Bailey, Marguerite; Wald, Elliot; Rowley, John","Solar cells were fabricated from iron containing minerals that are expected to be similar to those found in the Martian regolith: specular hematite, oolitic hematite, and hematite concretions. The solar cells were fabricated by electrophoretic deposition or drop casting of hematite nano-/micro-particles onto a fluorine-doped tin oxide substrate (FTO). Samples were tested in a wet cell configuration with a 0.5 M NaI and 0.05 M I2 redox mediator, a 0.1 M tetrabutylammonium hexafluorophosphate (TBAPF6) supporting electrolyte, an acetonitrile solvent, and a platinum (Pt) counter electrode. Current-Potential (iP) curves were obtained under 1 sun (0.5 AMU at 100 mW/cm2) of white light illumination. Specular hematite generated the highest power output of 3.5 μW/cm2 yielding a power conversion efficiency of 4.6x10-3%. Wavelength dependent solar cell efficiency was also characterized using incident photon conversion efficiency (IPCE) spectra, sample composition characterized using X-ray diffraction (XRD) spectra, and surface morphology characterized using scanning electron microscopy (SEM). Preliminary results with electrolyte-free hematite solar cells will be discussed. "
MT Tech Mountain Bike Skills Park,"Harken, Carson; Burns, Nathan; Colgan, Aidan; Fischer, Gary","This senior civil engineering design project is focused on upgrading the existing Mountain Bike Skills Park at Montana Technical University in Butte, MT. Given the lack of existing data, this project poses a particular challenge to develop baseline surfaces for design. This project seeks to create a design that provides an excellent opportunity for outdoor recreation and exercise. We will include in our presentation a summary of all aspects of our project, including how we gathered topographic/survey data and property boundary information, designed a mountain bike course incorporating all skill levels, created engineering details for course features, improved signage, provided area-wide drawings that show connections or potential connections of other nearby biking opportunities, and created construction drawings and technical specifications for the proposed park upgrades. "
Wausau Supply Parking Lot Design,"Gottwals, Van; Schake, Drake; Mancini, Ethan; Fischer, Gary","A location for a new Wausau Supply warehouse to be built has been proposed just outside Butte, Montana. Using provided survey data, geotechnical data, and Computer Aided Drafting (CAD) tools, we designed the site layout for a parking lot for the proposed building. We designed the parking lot and loading area in accordance with local county regulations using the American Association of State Highway and Traffic Officials Guide for Design of Pavement Structures assuming heavy loadings from the warehouse. We also considered the required drainage for the structures on site and designed a retention pond accordingly. Plans are drafted to complete construction along with all technical specifications. "
Study of a Diene / Dienophile System for Quantitative Determination of Activation Parameters for the Ruthenium-Sandwich Complex Acceleration of Diels-Alder Reaction,"Ackerman, Sebastian; Hitt, David","The Diels-Alder reaction involves two organic compounds possessing π systems, a diene and a dienophile, to form a 6-membered ring with a carbon-carbon π bond. Primarily used as a synthetic tool to create various medicinal compounds, Diels-Alder reactions can proceed at a reasonable rate by attaching an electron-withdrawing group (EWG) to the dienophile. Previous research by Carroll students in Dr. Hitt’s research program have shown (h5-cyclopentadienyl)ruthenium(II)(h6-aryl) substituents, [CpRu(h6-aryl)+], to be an effective EWG by facilitating the reaction of ethyl trans-cinnamate and 2,3-dimethyl-1,3-butadiene. For example, reacting [CpRu(h6-ethyl trans-cinnamate)]PF6 with 2,3-dimethyl-1,3-butadiene affords DA adduct under reflux conditions with nitromethane while reacting ethyl trans­-cinnamate with 2,3-dimethyl-1,3-butadiene afforded no product after 8 days of reflux. More detailed kinetic studies of the reaction, however, are hampered by the volatility of 2,3-dimethyl-1,3-butadiene which makes it difficult to control solute concentration. As a remedy, anthracene has been identified as a possible replacement as it is a crystalline, non-volatile solid at room temperature thus making its concentration easier to maintain under the high temperature reaction conditions. Herein, we report on our progress of using anthracene as a diene and [CpRu(h6 -ethyl trans-cinnamate)]PF6 as a dienophile. "
Synthesis of a Model CpFe(eta-6 -aryl) Substituted Dienophile,"Montowski, Claire","Diels-Alder (DA) reactions occur between two molecules, a diene and a dienophile, to form a six-membered ring. This structure is commonly found in natural products making it synthetically useful and causing the reaction to commonly be used in the formation of many pharmaceuticals and agrochemicals. However, under most circumstances, the DA reaction is limited by the dienophile needing an electron-withdrawing group to progress at a reasonable reaction rate. While there are numerous electron-withdrawing groups, most require chemical modification to be removed after the reaction. One possible alternative would be to use a dienophile containing an aryl substituent complexed to a (cyclopentadienyl)iron (II) monocationic fragment. This causes the attached 6-carbon ring to become electron-withdrawing, which would extend to the dienophile π-system as well. Furthermore, the metal fragment can later be removed by photolysis upon completion of the DA reaction. Previous research conducted with an analogous ruthenium complex displayed the metal fragment’s ability to accelerate the DA reaction compared to a control experiment with a non-metallated dienophile. The iron complex, by comparison, should have similar properties to the ruthenium complex based on its similar periodic properties and has the added benefit of being much less expensive and easier to remove photolytically. We will report our progress on synthesizing a model CpFe(η6 -aryl) substituted dienophile and on resulting studies into its reactivity in a DA reaction. Item Progress Toward the Synthesis of Next Generation Nonpeptidic Inhibitors of Sars-CoV-2 Main Protease (2023-04-28) Field, Cameren; Hitt, David The main protease (Mpro) of SARS-CoV-2, also known as 3CL, is a drug target of interest due to its critical function in cleaving the polyprotein which is translated from the viral RNA. Paxlovid, the FDA-approved drug from Pfizer, is a peptide-based inhibitor that covalently inhibits Mpro. My laboratory has developed a very potent series of nonpeptidic Mpro inhibitors that have several desirable properties compared to Paxlovid. The objective of this research was to develop a successful synthetic route to modify the lead nonpeptidic molecules in order to improve the pharmacological properties. The primary usefulness of the target molecule lies within its improved solubility in comparison to the lead inhibitor. Molecular modeling suggests that the target molecule will also increase the potency through an additional hydrogen bond to the Mpro enzyme. Herein is the reported progress toward the synthesis of next generation nonpeptidic inhibitors, CF1 and CF2. Use of 1H NMR and LC-MS spectral data for the synthetic intermediates was used to gauge the success of the chemical reactions within several attempted trials. CF1 has been successfully synthesized; its efficacy is being tested and the crystal structure of the compound bound to Mpro will be evaluated. "
