title,author,abstract
Continuous Labor Support and Cesarean Section Incidence,"Stanchfield, Kayla; Lewis, Melissa","In 2022, the rate of cesarean section delivery in the United States was 32.1% of all births in the country (Osterman, 2022). A cesarean section is an incision made in a mother’s abdomen and uterus to deliver a baby when it is determined to be safer than a vaginal birth (Johns Hopkins, 2023). Cesarean sections are associated with increased risks to maternal fertility, infection, hemorrhage, thromboembolic events, and hysterectomy (Keag, 2018). The Association of Women’s Health, Obstetric and Neonatal Nurses (AWHONN) (2021) recommends that there be a staffing ratio in perinatal units of one nurse to one laboring mother. AWHONN recommends this based as many complications may arise that can threaten the livelihood of mother and baby; adequate staffing is required to recognize early signs of complications, as well as to provide emotional support to laboring mothers. Methods to reduce stress including continuous support by a clinician, a positive birth environment, and social support have been shown to reduce labor stress and support endogenous oxytocin release, promoting a physiologic birth (Walter et al., 2021). The purpose of this Evidence-Based Practice review is to determine if there is an association between continuous support by a healthcare professional during the labor process and the risk of cesarean section. It is important to understand how continuous care could influence cesarean section risk to avoid an unnecessary invasive procedure that can have negative outcomes for mother and baby, and how nurses can fit into the role of one-to-one support providers. "
Delayed Cord Clamping in Newborns and Anemia,"Robb, Alexus; Lewis, Melissa","Anemia in infancy can lead to an array of issues with growth and development. According to Tiruneh et al. (2020), the prevalence of anemia in the newborn population is 25% worldwide. Anemia is caused by a lack of oxygen carrying red blood cells, which starves the body of oxygen. Prolonged anemia during development has been linked to various alterations in physical maturation and neurodevelopment. Researchers have hypothesized that umbilical cord clamping methods during delivery can play a critical role in developing anemia in infants. Furthermore, researchers offer ideas about the benefits of increased hemoglobin, hematocrit, and iron related to the use of delayed cord clamping (DCC) can last up to 6 months for term infants, as well as additional benefits for preterm infants. DCC involves clamping the umbilical cord after at least 60 seconds but up to 10 minutes of life. In comparison, early cord clamping (ECC) is characterized by the provider clamping the umbilical cord immediately upon delivery. Based on this information, the purpose of this Evidence Based Practice review is to determine the efficacy of DCC versus ECC in reducing anemia in infants. This simple and cost-effective measure is thought to significantly reduce the risk of anemia in infancy, and its following complications. Although the benefits of DCC versus ECC have been substantiated, the practice has not been fully adopted. Nurses will be able to help educate and spread awareness of this simple practice with expectant parents and practitioners alike. "
Breastfeeding and Neonatal Abstinence Syndrome,"Lovingood, Julia; Lewis, Melissa","An estimated three million people in the US are currently or have previously suffered from opioid use disorder (Azadfard et al., 2022), and pregnant women are not immune to this misuse problem. Nearly 7% of women in 2019 self-reported using prescription opioids during pregnancy (Centers for Disease Control and Prevention, 2022). This has led to an uptick in the incidence of neonatal abstinence syndrome (NAS), which results following the cessation of exposure to substance(s) to which the fetus was exposed in-utero (Center for Substance Abuse Treatment, 2005). In 2018, approximately seven newborns were diagnosed with NAS for every 1,000 hospital births (Hirai et al., 2021). Neonates with NAS showed an increased length of hospitalization, which is associated with increased healthcare costs and poor bonding between the mother and neonate (Lean et al., 2018). Breastfeeding has the ability to strengthen bonding, and oxytocin released during lactation helps stimulate emotional connection between the mother and child (World Health Organization, 2009). The American Academy of Pediatrics and the Academy of Breastfeeding Medicine have developed breastfeeding recommendations in the NAS population. Despite these recommendations, successful breastfeeding in the NAS population is still quite low. The purpose of this Evidence-Based Practice brief is to review literature to determine if breastfeeding has an effect on length of hospital stay in neonates with NAS. Ultimately, the aim of this brief is to elucidate findings on this matter and help generate recommendations for best practice for nurses caring for newborns with NAS. "
Pregnancy Outcomes Related to COVID-19,"Rietmann, Annika; Lewis, Melissa","Starting in late 2019, COVID-19 began to spread rapidly through the United States. This stretched our healthcare system thin and healthcare providers were left with questions on how to treat vulnerable populations, including pregnant women. COVID-19 is primarily a respiratory illness but has shown to negatively affect other body systems as well (Centers for Disease Control and Prevention, (2022b). From January 2020 to July 2022, a total of 225,656 pregnant women had COVID-19 during gestation. The U.S Government and Accountability office (2022) reported that 25% of maternal deaths were due to COVID-19 in 2020 and 2021. This Evidenced-Based Practice (EBP) review is comparing maternal complications of women who were infected with COVID-19 while pregnant to women who did not get the illness during gestation. Complications of pregnancy include preterm labor, miscarriage, postpartum hemorrhage, sepsis, and even death. EBP allows healthcare providers to give top quality care. If nurses understand what complications women are at risk for if infected with COVID-19, labor and delivery teams may be better prepared for complications that may arise. "
Perineal Massage and Reduction in Perineal Trauma During Vaginal Delivery,"Booth, Jane; Hogue, Meagan; Lewis, Melissa","During vaginal childbirth, the region between the vulva and the anus, also known as the perineum, is susceptible to trauma due to stretching and tearing as the baby's head emerges, often resulting in lacerations, especially for nulliparous women, women who’ve never given birth before. Furthermore, episiotomies are procedures that are often performed during vaginal childbirth in which a surgical incision is made from the vagina into the perineum to attempt to prevent tissue rupture and help with difficult or fast births. Unfortunately, these often result in further tearing, more blood loss, infection, and postpartum pain (Ramar and Grimes, 2022). As for incidence, vaginal deliveries in the United States totaled 2,486,856 in 2021 (CDC, 2023). Over 85% of women that deliver vaginally experience some degree of laceration and/or episiotomy, increasing to 90.4% for those that are nulliparous or primiparous (Smith, 2013). Perineal massage (PM) is an intervention that can be performed during pregnancy to prepare the perineum for childbirth by stretching and softening the tissues in the perineum, making it more flexible and reducing the risk of trauma during delivery (Ramar and Grimes, 2022). The purpose of this evidenced based practice review is to examine the effects of PM compared to no PM on nulliparous/primiparous women delivering vaginally. Nurses or other healthcare providers can use this information to see if perineal massage is a beneficial intervention that can improve health outcomes in women during childbirth and reduce the incidence of perineal trauma. "
The Effect of Music Therapy on Preterm Infants’ Neurodevelopment,"Kemp, Phoebe; Hynson, Kira; Bubb, Nicholas; Hogue, Meagan","Preterm infants can suffer a decrease in neurodevelopment because of the lack of time they have in the womb to develop fully. A preterm infant is defined as any baby born before 37 weeks of gestation (World Health Organization, 2022). Compared to an infant born at full term, preterm infants can suffer from an increased risk of mortality and neurological deficits that extend throughout their lives (Woythaler, 2019). According to the CDC (n.d.), in the United States one out of every 10 babies are born preterm and thus the issue of decreased neurodevelopment is prominent. One key area of development that is diminished, due to preterm birth, is in the brain. Neurodevelopment is the process in which neurons and synaptic connections form to construct an individual’s ability to learn, focus, make decisions, and socialize, etc. (Oliphant & Lu, 2020). The purpose of this Evidence-Based Practice review is to examine the effect that music therapy has on the neurodevelopment of preterm infants. Nurses or other healthcare providers can use this information as an intervention to promote and improve the neurodevelopment and functional brain activity of preterm infants during their stay in the hospital and as a recommendation to parents beyond their hospital stay. "
Aromatherapy Effects on Postoperative Pain Management,"Mork, Hannah; Anderson, Echo; Hill, Elias; Hogue, Meagan","A large part of postoperative care revolves around pain management for the patient. Pain is a subjective experience, meaning it varies greatly from patient to patient. This requires nurses to have various methods of pain control available to meet the diverse needs of patients. Inadequate pain management in the postoperative phase of care can lead to slower recovery, adverse physiologic and psychologic effects, trauma for the patient, and can lead to worse patient outcomes overall (Horn & Kramer, 2022). Whether it is through pharmacologic or nonpharmacologic methods, all patients have a right to adequate pain management. Complementary therapies are a way for patients to ease their pain. The purpose of this evidence-based practice review is to examine how the use of aromatherapy as an adjunct to pharmacological pain management will affect pain control in postoperative patients. For the purpose of this research, aromatherapy is defined as the therapeutic use of essential oils distilled from plants (Venes, 2021). The outcome of this review will provide healthcare providers with information regarding the efficacy of alternative pain management in order to explore methods to provide patients with better pain control. In turn, this will allow nurses and other healthcare providers to better facilitate recovery for patients in the postoperative period and improve their postoperative outcomes. "
Childhood Trauma and Major Depression in Adulthood,"George, Sophie; Hogue, Meagan; Lewis, Melissa","Childhood trauma and major depression in adulthood are pressing issues in the United States today. High adverse childhood experiences scores (ACEs) are prevalent – one in six adults in the United States reported experiencing four or more types of ACEs in their lifetime when surveyed in November 2019 (Centers for Disease Control and Prevention [CDC], 2019). Depression is also a widespread and common disorder – the 2020 National Survey on Drug Use and Health found that 21 million adults 18 or older in the United States had at least one major depressive episode in 2020, representing 8.4% of adults in the United States (National Institute of Mental Health, 2022b). The ACEs Questionnaire is a 10-question scoring system that measures trauma before the age of 18 – it asks questions related to emotional or sexual abuse, substance use within the home, death, divorce, a parent who is incarcerated, and more. The Childhood Maltreatment (CM) scoring system operates similarly, giving a score of 0 to 20, with higher scores reflecting greater severity of maltreatment. Due to the high incidence of both childhood trauma and major depression in adults, it is relevant to ask if the two are positively correlated; the purpose of this evidence-based practice review is to better understand the relationship between childhood trauma and major depression in adulthood. Nurses and other healthcare professionals can use this information to provide trauma-informed care to psychiatric patients and any patient with coexisting psychiatric conditions. "
Music Therapy and Pain Relief in the Stages of Labor,"Kohler, Sophia; Hert, Mikayla; Bourekis, Maria; Hogue, Meagan","The intrapartum period is said to be one of the most painful experiences a woman may have and is highly individualized. Pain control is a major concern for the healthcare team, and there are several studies for pain management including nonpharmacological methods such as music therapy. According to Buglione et al. (2020), the use of epidural anesthesia is more effective in reducing pain during labor but increases the risk of an operative vaginal delivery or cesarean section. Therefore, an approach such as music therapy for pain relief is a goal for nurses (Buglione et al., 2020). The music therapy discussed within these studies included listening to an array of musical audio during the birthing process. The intrapartum period as it relates to this systematic review is defined as “occurring or provided during the act of birth” (Merriam-Webster, n.d., para. 1). The purpose of this Evidence-Based Practice project is to examine the relationship between music therapy and pain during the intrapartum period. Several studies have shown that music therapy is effective in reducing painful stimuli and anxiety levels, both psychologically and physiologically. According to McCaffery et al. (2020), fifteen studies reported evidential results that support the hypothesis that music reduces pain during and after labor (McCaffery et al., 2020). By implementing this simple, non-pharmacological intervention, healthcare providers can use this information to reduce pain ratings during the stages of labor. "
"Mindfulness, Nursing Practice, & Pain","Chan, Mitchell; Brosnan, Maria; Lewis, Melissa","Pain control is a significant public health concern that permeates through all demographics & diseases. Almost two-thirds of primary providers’ patients report pain, while a third of emergency department visits are due to pain (Hoffman & Sullivan, 2020). There are a deluge of therapies to slake the bite of pain, both pharmacological & nonpharmacological in nature. Psychotherapy is a subdivision of the nonpharmacological adjuncts to pain control, including a growing body of research on mindfulness-based interventions (MBI). These interventions drove the creation of the research question featured in this evidence-based practice brief: For patients experiencing pain, do mindfulness-based interventions when compared to non-mindfulness interventions reduce a patient’s reported pain? Mindfulness is described by Bishop et al. (2004) as a focus on present experiences to increase one’s awareness of their thoughts & sensations, in addition to an open-minded predisposition towards the present experience. MBIs in the context of this review are self-administered interventions that can be done independently, using pre-recorded audio to guide mindfulness practice or an application with exercises in mindfulness. This brief quantified pain using a numerical scale, although the authors often used additional inventories to measure psychological health. The purpose of this evidenced-based practice brief is to investigate the potential of MBIs in pain control. Nurses & their team can utilize this category of interventions to promote patient choice & involvement in the management of pain, in addition to potentially reducing their stress. MBIs offer an additional noninvasive therapy to patients, which can be titrated by them. "
End-of-Life Care: Does Knowledge of Care impact Quality of Care,"Snow, Kathleen; Lewis, Melissa; Brosnan, Maria","End of Life Care (EOLC) is a common need among elderly and terminally ill patients. Currently, one in 10 patients in the ICU (Intensive Care Unit) are elderly (over age 65-years-old), and 4 in 10 adults have two or more chronic diseases or illnesses. Half of these individuals will die in a hospital or long-term care setting. Both populations are expected to grow at exponential rates over the next 30 years. Coupled with nursing shortages currently leaving ICU ratios of 1:4, the quality of EOLC is in jeopardy of suffering. ICU nurses provide EOLC regularly. However, a lack of knowledge of what quality EOLC is can have negative repercussions on the patient and families. This means that instead of approaching a patient as a list of terminal illnesses, they can approach them as a human experiencing the end of their life. This is a pivotal moment for someone passing on, as well as for their family dealing with this loss. The purpose of this Evidence-Based Practice review is to determine if a knowledge of EOLC has an impact on the quality of EOLC given by ICU nurses. It is thought that quality EOLC can come only with experience. However, continuing education can provide caregivers with necessary skills to assist EOLC patients in the ICU. Nurses and other healthcare providers can use this information to include advanced directives, communicate openly with patients and families, and keep care team members on the same page, limiting obstacles to quality EOLC. "
Estimating the Temperature of Solar Flares from X-Ray Emission Data,"Johnson, Max; Cline, Kelly","Solar flares are large eruptions of electromagnetic radiation caused primarily by instabilities in the sun’s magnetic field. They are an area of significant interest in solar physics as they provide information about the composition and magnetic nature of the sun. The influx of radiation from particularly powerful flares can also cause radio blackouts on Earth, further increasing their relevance. Solar flares emit a wide range of electromagnetic wavelengths, including significant x-ray radiation. The NASA Geostationary Operational Environmental Satellite (GOES) network continuously collects measurements of the sun’s x-ray emissions, including during solar flares, via a pair of instruments. These two instruments are known as the “short” and “long” channels of the GOES X-Ray Sensors (XRS). The internal specifications of these instruments along with a solar flare model can be used to calculate a numerical value for the response of each instrument as a function of temperature of the solar flare. The short and long channels of GOES XRS demonstrate consistently different but comparable responses for a given range of temperatures. By comparing the ratio of the responses to each other, it can be shown that given ratios of responses correspond to temperatures of solar flares. "
Effects of COVID-19 on Student Achievement,"Ramirez, Rosalina; Boese, Courtney; Arnold, Mekenzie; Edwards, Trinity; Gilboy, Kathy","Our research project is a meta-analysis of findings throughout the world on the effects of COVID-19 and distance learning for students of all ages. Effect categories included, but were not limited to, self-efficacy, social connectedness, mental health, and academic achievement. Many of these studies surveyed students’ first-hand experiences of learning before the pandemic, during the lockdown, and after distance and hybrid learning was implemented. Students surveyed were of all ages, from preschool through college. The vast majority of the experiences reported were overwhelmingly negative in all categories. As students began to move back into in-person learning the negative effects they felt on their productivity and motivation continued. This led us to conclude that the effects of COVID-19 made a significant impact on students socially, mentally, and educationally. These effects need to be recognized by teachers and administrators, as they will impact classrooms worldwide for the foreseeable future. "
How to Incorporate the History of Mathematics into Secondary Classrooms,"Ryan, Rachel; Fasteen, Jodi","Students learn mathematics better when they are excited about the subject and engaged during class time. One way to promote student engagement in math classes is to teach topics in the context they were discovered. In this presentation, several topics included in middle school and high school math curriculum will be shared in their historical context. Topics include the Pythagorean brotherhood, the controversy of the number zero and irrational numbers, how algebra originated, the debates on calculus, China and India’s contributions, and how symbols were developed to represent numbers. "
Determining Musical Genre,"Bonar, Catherine; Fasteen, Jodi","For decades, artists have been creating new styles of music and different genres based upon different inspirations. Artists are continually asked “who has inspired you?” or “what has influenced your music?” Using a dataset filled with this information about different artists and their influences, we have worked to create a predictive model that determines just how closely correlated a follower’s music is to their muse. We also used additional information about specific songs from various artists to help in our process. From keys to tempo, all songs have numeric and categorical ways that they can be quantified. Using the different numeric characteristics of music, we have found a way to predict what genre a song will fall into. Using these predictions, and understanding the numeric values of different genres, we can observe how current artists have either stayed or strayed from their influencers. "
Radium Ranch Septic Design for Subdivision Review,"Linn, Maya; Fischer, Gary","This project focuses on the design of on-site water and wastewater systems for a small subdivision located in Butte Silver Bow County. The 122 acre property will be split into five parcels, each of different sizes and characteristics. Our team was tasked with complying with several regulatory standards and agencies while also working to satisfy the clients needs in terms of property layout. The overall goal of this project is to design for a septic system on each of the five subdivided lots so that the client can receive a permit compliant with the subdivision review process. In our presentation, we will discuss the level of septic treatment needed at each site, the layout and design of septic tanks and their drain fields, along with a final engineering cost estimate for the project. "
East Helena Wastewater Nitrogen Study,"Burgess, Matthew; Sassano, Colin; Powell, Stephen; Fischer, Gary","The City of East Helena is experiencing rapid growth within the City limits. As the population continues to grow, the Wastewater Treatment Plant (WWTP) will see an increased load. All wastewater plants around the state are given a discharge permit that depends on a variety of factors including where the treated effluent is discharged. In East Helena’s case, they are discharging into a small stream called Prickly Pear Creek. Smaller streams require more treatment because there is less dilution capacity. While the City has not yet violated their permit, continued growth in the area and increased loads on the plant will require a better treatment process than is currently being utilized. Our goal is to design a solution to improve the treatment efficiency for removing Nitrogen in the East Helena WWTP to prevent Nitrogen levels in Prickly Pear Creek from exceeding the limit. In our presentation, we will describe why we chose to convert the current aeration basin to a Modified Ludzack-Ettinger (MLE) process, the current site conditions, gathered data, design criteria and constraints, environmental and societal impacts, cost estimate, and required permitting. The MLE process will create two separate zones, anoxic and aerobic, to facilitate the removal of nitrogen in the water. "
Investigation into the Predominant Pathway by which Ashwagandha Increases Testosterone,"Held, Benjamin; Romney, Kaiden; Sheafor, Brandon","Ashwagandha is an herb native to Asia and Africa that has received much attention in recent years for its “heal-all” abilities. Advocates of the root claim that it relieves stress and anxiety, lowers blood sugar, increases muscle performance, boosts sexual hormones, improves focus and memory, increases heart health, and may even have clinical applications in cancer treatment. Although a fair amount of research has been performed on the effects of ashwagandha, little is known about the mechanism by which it boosts testosterone and subsequently increases muscular performance. The object of this experiment is to determine whether or not luteinizing hormone (LH) is the predominant pathway by which testosterone is increased. Ashwagandha may promote the release of gonadotropin-releasing hormone (GnRH) from the hypothalamus, which in turn promotes the release of LH from the pituitary gland to stimulate testosterone production. To test this, three experimental groups of frogs will be given one of the following treatments: 1.) control (no chemical exposure), 2.) exposure to GnRH, 3.) exposure to ashwagandha extract. At the end of the treatment period, all frogs will be evaluated for LH and testosterone concentrations in plasma and urine. If ashwagandha does increase testosterone primarily through the LH pathway, then the concentration ratio of LH to testosterone should be equivalent between the GnRH treatment group and the ashwagandha treatment group. If an equivalent ratio is not detected, more research will be required to determine by which alternative physiological pathway ashwagandha increases testosterone. "
